{"bounds":{"maximum":20.0,"minimum":-20.0},"case_kinds":["fixed-zero","boundary-alternating","seeded-interior"],"entries":[{"case_id":"v1-b1-h2-s1-d16-fixed-zero-seed0","kind":"fixed-zero","seed":0,"shape":{"B":1,"D":16,"H":2,"S":1}},{"case_id":"v1-b1-h2-s1-d16-boundary-alternating-seed0","kind":"boundary-alternating","seed":0,"shape":{"B":1,"D":16,"H":2,"S":1}},{"case_id":"v1-b1-h2-s1-d16-seeded-interior-seed0","kind":"seeded-interior","seed":0,"shape":{"B":1,"D":16,"H":2,"S":1}},{"case_id":"v1-b1-h2-s1-d32-fixed-zero-seed0","kind":"fixed-zero","seed":0,"shape":{"B":1,"D":32,"H":2,"S":1}},{"case_id":"v1-b1-h2-s1-d32-boundary-alternating-seed0","kind":"boundary-alternating","seed":0,"shape":{"B":1,"D":32,"H":2,"S":1}},{"case_id":"v1-b1-h2-s1-d32-seeded-interior-seed0","kind":"seeded-interior","seed":0,"shape":{"B":1,"D":32,"H":2,"S":1}},{"case_id":"v1-b1-h2-s1-d64-fixed-zero-seed0","kind":"fixed-zero","seed":0,"shape":{"B":1,"D":64,"H":2,"S":1}},{"case_id":"v1-b1-h2-s1-d64-boundary-alternating-seed0","kind":"boundary-alternating","seed":0,"shape":{"B":1,"D":64,"H":2,"S":1}},{"case_id":"v1-b1-h2-s1-d64-seeded-interior-seed0","kind":"seeded-interior","seed":0,"shape":{"B":1,"D":64,"H":2,"S":1}},{"case_id":"v1-b1-h2-s16-d16-fixed-zero-seed0","kind":"fixed-zero","seed":0,"shape":{"B":1,"D":16,"H":2,"S":16}},{"case_id":"v1-b1-h2-s16-d16-boundary-alternating-seed0","kind":"boundary-alternating","seed":0,"shape":{"B":1,"D":16,"H":2,"S":16}},{"case_id":"v1-b1-h2-s16-d16-seeded-interior-seed0","kind":"seeded-interior","seed":0,"shape":{"B":1,"D":16,"H":2,"S":16}},{"case_id":"v1-b1-h2-s16-d32-fixed-zero-seed0","kind":"fixed-zero","seed":0,"shape":{"B":1,"D":32,"H":2,"S":16}},{"case_id":"v1-b1-h2-s16-d32-boundary-alternating-seed0","kind":"boundary-alternating","seed":0,"shape":{"B":1,"D":32,"H":2,"S":16}},{"case_id":"v1-b1-h2-s16-d32-seeded-interior-seed0","kind":"seeded-interior","seed":0,"shape":{"B":1,"D":32,"H":2,"S":16}},{"case_id":"v1-b1-h2-s16-d64-fixed-zero-seed0","kind":"fixed-zero","seed":0,"shape":{"B":1,"D":64,"H":2,"S":16}},{"case_id":"v1-b1-h2-s16-d64-boundary-alternating-seed0","kind":"boundary-alternating","seed":0,"shape":{"B":1,"D":64,"H":2,"S":16}},{"case_id":"v1-b1-h2-s16-d64-seeded-interior-seed0","kind":"seeded-interior","seed":0,"shape":{"B":1,"D":64,"H":2,"S":16}},{"case_id":"v1-b1-h2-s32-d16-fixed-zero-seed0","kind":"fixed-zero","seed":0,"shape":{"B":1,"D":16,"H":2,"S":32}},{"case_id":"v1-b1-h2-s32-d16-boundary-alternating-seed0","kind":"boundary-alternating","seed":0,"shape":{"B":1,"D":16,"H":2,"S":32}},{"case_id":"v1-b1-h2-s32-d16-seeded-interior-seed0","kind":"seeded-interior","seed":0,"shape":{"B":1,"D":16,"H":2,"S":32}},{"case_id":"v1-b1-h2-s32-d32-fixed-zero-seed0","kind":"fixed-zero","seed":0,"shape":{"B":1,"D":32,"H":2,"S":32}},{"case_id":"v1-b1-h2-s32-d32-boundary-alternating-seed0","kind":"boundary-alternating","seed":0,"shape":{"B":1,"D":32,"H":2,"S":32}},{"case_id":"v1-b1-h2-s32-d32-seeded-interior-seed0","kind":"seeded-interior","seed":0,"shape":{"B":1,"D":32,"H":2,"S":32}},{"case_id":"v1-b1-h2-s32-d64-fixed-zero-seed0","kind":"fixed-zero","seed":0,"shape":{"B":1,"D":64,"H":2,"S":32}},{"case_id":"v1-b1-h2-s32-d64-boundary-alternating-seed0","kind":"boundary-alternating","seed":0,"shape":{"B":1,"D":64,"H":2,"S":32}},{"case_id":"v1-b1-h2-s32-d64-seeded-interior-seed0","kind":"seeded-interior","seed":0,"shape":{"B":1,"D":64,"H":2,"S":32}},{"case_id":"v1-b1-h2-s64-d16-fixed-zero-seed0","kind":"fixed-zero","seed":0,"shape":{"B":1,"D":16,"H":2,"S":64}},{"case_id":"v1-b1-h2-s64-d16-boundary-alternating-seed0","kind":"boundary-alternating","seed":0,"shape":{"B":1,"D":16,"H":2,"S":64}},{"case_id":"v1-b1-h2-s64-d16-seeded-interior-seed0","kind":"seeded-interior","seed":0,"shape":{"B":1,"D":16,"H":2,"S":64}},{"case_id":"v1-b1-h2-s64-d32-fixed-zero-seed0","kind":"fixed-zero","seed":0,"shape":{"B":1,"D":32,"H":2,"S":64}},{"case_id":"v1-b1-h2-s64-d32-boundary-alternating-seed0","kind":"boundary-alternating","seed":0,"shape":{"B":1,"D":32,"H":2,"S":64}},{"case_id":"v1-b1-h2-s64-d32-seeded-interior-seed0","kind":"seeded-interior","seed":0,"shape":{"B":1,"D":32,"H":2,"S":64}},{"case_id":"v1-b1-h2-s64-d64-fixed-zero-seed0","kind":"fixed-zero","seed":0,"shape":{"B":1,"D":64,"H":2,"S":64}},{"case_id":"v1-b1-h2-s64-d64-boundary-alternating-seed0","kind":"boundary-alternating","seed":0,"shape":{"B":1,"D":64,"H":2,"S":64}},{"case_id":"v1-b1-h2-s64-d64-seeded-interior-seed0","kind":"seeded-interior","seed":0,"shape":{"B":1,"D":64,"H":2,"S":64}},{"case_id":"v1-b1-h2-s128-d16-fixed-zero-seed0","kind":"fixed-zero","seed":0,"shape":{"B":1,"D":16,"H":2,"S":128}},{"case_id":"v1-b1-h2-s128-d16-boundary-alternating-seed0","kind":"boundary-alternating","seed":0,"shape":{"B":1,"D":16,"H":2,"S":128}},{"case_id":"v1-b1-h2-s128-d16-seeded-interior-seed0","kind":"seeded-interior","seed":0,"shape":{"B":1,"D":16,"H":2,"S":128}},{"case_id":"v1-b1-h2-s128-d32-fixed-zero-seed0","kind":"fixed-zero","seed":0,"shape":{"B":1,"D":32,"H":2,"S":128}},{"case_id":"v1-b1-h2-s128-d32-boundary-alternating-seed0","kind":"boundary-alternating","seed":0,"shape":{"B":1,"D":32,"H":2,"S":128}},{"case_id":"v1-b1-h2-s128-d32-seeded-interior-seed0","kind":"seeded-interior","seed":0,"shape":{"B":1,"D":32,"H":2,"S":128}},{"case_id":"v1-b1-h2-s128-d64-fixed-zero-seed0","kind":"fixed-zero","seed":0,"shape":{"B":1,"D":64,"H":2,"S":128}},{"case_id":"v1-b1-h2-s128-d64-boundary-alternating-seed0","kind":"boundary-alternating","seed":0,"shape":{"B":1,"D":64,"H":2,"S":128}},{"case_id":"v1-b1-h2-s128-d64-seeded-interior-seed0","kind":"seeded-interior","seed":0,"shape":{"B":1,"D":64,"H":2,"S":128}},{"case_id":"v1-b1-h4-s1-d16-fixed-zero-seed0","kind":"fixed-zero","seed":0,"shape":{"B":1,"D":16,"H":4,"S":1}},{"case_id":"v1-b1-h4-s1-d16-boundary-alternating-seed0","kind":"boundary-alternating","seed":0,"shape":{"B":1,"D":16,"H":4,"S":1}},{"case_id":"v1-b1-h4-s1-d16-seeded-interior-seed0","kind":"seeded-interior","seed":0,"shape":{"B":1,"D":16,"H":4,"S":1}},{"case_id":"v1-b1-h4-s1-d32-fixed-zero-seed0","kind":"fixed-zero","seed":0,"shape":{"B":1,"D":32,"H":4,"S":1}},{"case_id":"v1-b1-h4-s1-d32-boundary-alternating-seed0","kind":"boundary-alternating","seed":0,"shape":{"B":1,"D":32,"H":4,"S":1}},{"case_id":"v1-b1-h4-s1-d32-seeded-interior-seed0","kind":"seeded-interior","seed":0,"shape":{"B":1,"D":32,"H":4,"S":1}},{"case_id":"v1-b1-h4-s1-d64-fixed-zero-seed0","kind":"fixed-zero","seed":0,"shape":{"B":1,"D":64,"H":4,"S":1}},{"case_id":"v1-b1-h4-s1-d64-boundary-alternating-seed0","kind":"boundary-alternating","seed":0,"shape":{"B":1,"D":64,"H":4,"S":1}},{"case_id":"v1-b1-h4-s1-d64-seeded-interior-seed0","kind":"seeded-interior","seed":0,"shape":{"B":1,"D":64,"H":4,"S":1}},{"case_id":"v1-b1-h4-s16-d16-fixed-zero-seed0","kind":"fixed-zero","seed":0,"shape":{"B":1,"D":16,"H":4,"S":16}},{"case_id":"v1-b1-h4-s16-d16-boundary-alternating-seed0","kind":"boundary-alternating","seed":0,"shape":{"B":1,"D":16,"H":4,"S":16}},{"case_id":"v1-b1-h4-s16-d16-seeded-interior-seed0","kind":"seeded-interior","seed":0,"shape":{"B":1,"D":16,"H":4,"S":16}},{"case_id":"v1-b1-h4-s16-d32-fixed-zero-seed0","kind":"fixed-zero","seed":0,"shape":{"B":1,"D":32,"H":4,"S":16}},{"case_id":"v1-b1-h4-s16-d32-boundary-alternating-seed0","kind":"boundary-alternating","seed":0,"shape":{"B":1,"D":32,"H":4,"S":16}},{"case_id":"v1-b1-h4-s16-d32-seeded-interior-seed0","kind":"seeded-interior","seed":0,"shape":{"B":1,"D":32,"H":4,"S":16}},{"case_id":"v1-b1-h4-s16-d64-fixed-zero-seed0","kind":"fixed-zero","seed":0,"shape":{"B":1,"D":64,"H":4,"S":16}},{"case_id":"v1-b1-h4-s16-d64-boundary-alternating-seed0","kind":"boundary-alternating","seed":0,"shape":{"B":1,"D":64,"H":4,"S":16}},{"case_id":"v1-b1-h4-s16-d64-seeded-interior-seed0","kind":"seeded-interior","seed":0,"shape":{"B":1,"D":64,"H":4,"S":16}},{"case_id":"v1-b1-h4-s32-d16-fixed-zero-seed0","kind":"fixed-zero","seed":0,"shape":{"B":1,"D":16,"H":4,"S":32}},{"case_id":"v1-b1-h4-s32-d16-boundary-alternating-seed0","kind":"boundary-alternating","seed":0,"shape":{"B":1,"D":16,"H":4,"S":32}},{"case_id":"v1-b1-h4-s32-d16-seeded-interior-seed0","kind":"seeded-interior","seed":0,"shape":{"B":1,"D":16,"H":4,"S":32}},{"case_id":"v1-b1-h4-s32-d32-fixed-zero-seed0","kind":"fixed-zero","seed":0,"shape":{"B":1,"D":32,"H":4,"S":32}},{"case_id":"v1-b1-h4-s32-d32-boundary-alternating-seed0","kind":"boundary-alternating","seed":0,"shape":{"B":1,"D":32,"H":4,"S":32}},{"case_id":"v1-b1-h4-s32-d32-seeded-interior-seed0","kind":"seeded-interior","seed":0,"shape":{"B":1,"D":32,"H":4,"S":32}},{"case_id":"v1-b1-h4-s32-d64-fixed-zero-seed0","kind":"fixed-zero","seed":0,"shape":{"B":1,"D":64,"H":4,"S":32}},{"case_id":"v1-b1-h4-s32-d64-boundary-alternating-seed0","kind":"boundary-alternating","seed":0,"shape":{"B":1,"D":64,"H":4,"S":32}},{"case_id":"v1-b1-h4-s32-d64-seeded-interior-seed0","kind":"seeded-interior","seed":0,"shape":{"B":1,"D":64,"H":4,"S":32}},{"case_id":"v1-b1-h4-s64-d16-fixed-zero-seed0","kind":"fixed-zero","seed":0,"shape":{"B":1,"D":16,"H":4,"S":64}},{"case_id":"v1-b1-h4-s64-d16-boundary-alternating-seed0","kind":"boundary-alternating","seed":0,"shape":{"B":1,"D":16,"H":4,"S":64}},{"case_id":"v1-b1-h4-s64-d16-seeded-interior-seed0","kind":"seeded-interior","seed":0,"shape":{"B":1,"D":16,"H":4,"S":64}},{"case_id":"v1-b1-h4-s64-d32-fixed-zero-seed0","kind":"fixed-zero","seed":0,"shape":{"B":1,"D":32,"H":4,"S":64}},{"case_id":"v1-b1-h4-s64-d32-boundary-alternating-seed0","kind":"boundary-alternating","seed":0,"shape":{"B":1,"D":32,"H":4,"S":64}},{"case_id":"v1-b1-h4-s64-d32-seeded-interior-seed0","kind":"seeded-interior","seed":0,"shape":{"B":1,"D":32,"H":4,"S":64}},{"case_id":"v1-b1-h4-s64-d64-fixed-zero-seed0","kind":"fixed-zero","seed":0,"shape":{"B":1,"D":64,"H":4,"S":64}},{"case_id":"v1-b1-h4-s64-d64-boundary-alternating-seed0","kind":"boundary-alternating","seed":0,"shape":{"B":1,"D":64,"H":4,"S":64}},{"case_id":"v1-b1-h4-s64-d64-seeded-interior-seed0","ki